{
  "job_name": "barracuda_sweep",
  "volume_mesh_params": {
    "boundary_layer_growth_rate": 1.2,
    "boundary_layer_first_layer_thickness": 0.001
  },
  "velocity_magnitude": 100,
  "alpha": 20,
  "beta": 5,
  "sweep_schema": {
    "variable": "alpha",
    "values": [0, 5, 10, 15, 20],
        "unit": "fl.u.deg"
  }
}
